<!ELEMENT students (student+)>

<!ELEMENT student (name, age, course)>

<!ELEMENT name (#PCDATA)>
<!ELEMENT age (#PCDATA)>
<!ELEMENT course (#PCDATA)>